PS_PARTKEY | PS_SUPPKEY | PS_AVAILQTY | PS_SUPPLYCOST | PS_COMMENT
248|9|7731|65.54|ronic accounts haggle blithely across the blithely special platelets. furiously final ideas haggle carefully after the fluffily unusual dep
248|24|8847|935.64|ular, regular requests affix ironically enticing ideas. fur
248|9|6329|148.79|enticingly final ideas sleep fluffily. blithely final ideas boost fluffily ironic asymptote
248|24|8054|425.78|the express accounts. even, ironic pinto beans wake furious
249|10|7234|516.17|out the ironic, even deposits. express, regular accounts boost blithely carefully regular requests. special multipliers detect slyly ironic foxes. furiously f
249|25|5568|50.74|ests wake permanently along the packages. ironic excuses x-ray alongside of the regular packa
249|10|1861|914.16|sleep about the unusual packages. slyly furious deposits at the slyly final requests boost blithely about the slyly ironic pinto beans. slyly express deposits aga
249|25|7766|815.94|usly enticing dependencies according to the silent requests haggle ironic, bold packages. blithely express requests boost alongside of the slyly regular deposits. unusual pinto beans 
250|11|3525|293.30| slyly special deposits play. silent attainments according to the furiously 
250|26|5208|617.59| theodolites about the doggedly brave excuses detect carefull
250|11|7071|374.36|es. express frets nag. pending packages haggle carefully across the final instructions. quickly ironic
250|26|4647|281.06|ironic packages. blithely special packages affix. quickly regular instructions wake carefully pending, regular packages. carefully silent deposits promise quickly outside the 
251|12|6748|703.47| furiously thin requests poach blithely. carefully ironic pinto beans sleep carefully e
251|27|6020|154.11|riously regular packages integrate carefully across the carefully even Tiresias. fluffily express realms wake slyly packages. thinly final deposits wake ironic, express requests
251|12|9298|883.57| haggle carefully. special, special accounts sleep slyly. blithely bold instructions according to the blithely unusual deposits serve furiously under the even 
251|27|5130|183.19|side of the foxes haggle among the dinos. bold, pending instructions haggle blithely about the blithely regular requests. packages affix blithely. furiously re
252|13|8207|168.05|ess accounts doubt express requests. regular, special instructions use blithely blithely express 
252|28|1220|412.54|ly bold requests. even, special deposits are against the furiously bold
252|13|2813|734.15|ly regular courts sleep slyly ironic accounts. carefully express asymptotes are. blithely furious packages are quickly always regular accounts. q
252|28|7645|275.23| blithely bold requests use furiously against the final packages. furiously pending excuses poach carefully after the blithely even packages. slyly regula
253|14|544|658.08|fter the finally bold packages. slyly pending requests boost carefully. furiously special deposits sleep carefully bold deposits. carefully final somas haggle outside the furious, expres
253|29|1705|515.91|structions. furiously ironic packages use blithely. theodolites ought to sleep. ev
253|14|6523|783.87|courts sleep slyly across the fluffily unusual excu
253|29|3540|797.50|eposits use across the slyly special asymptotes. carefully final sauternes wake blithely across the furiously final dolphins. slyly 
254|15|2058|111.11|r theodolites haggle along the slyly unusual theodolites. slyly regular orbit
254|30|717|564.77| asymptotes. carefully silent requests wake carefully unusual excuses. sometimes pending packages poach 
254|15|8773|729.13|unusual packages boost. slyly ironic accounts maintain after the blithely regular ideas. quickly final requests against the regular requests sleep slyly about the furiously
254|30|1762|940.29|rding to the blithely ruthless multipliers sleep slyly blithely final dependencies. slyly reg
255|16|7540|307.78|ages sleep carefully carefully close ideas. special pinto beans x-ray alongside of the final deposits. slyly dogged deposits could haggle slyly. s
255|1|8151|225.64|ns haggle carefully excuses. carefully regular depos
255|16|2314|362.37|furiously regular accounts; unusual dependencies according to the ironic, express instructions haggle ironic deposits. slyly unusual instructions nag quickly slyly regular instructions. ne
255|1|8412|720.85|ructions are carefully silent decoys. bold deposits cajole slyly: deposits to the even foxes hinder furiously unusual requests. fina
256|17|7261|583.85|arefully regular requests. fluffily special packages are about the quickly bold foxes. blithely bold platelets cajole across the f
256|2|1240|822.40| regular multipliers wake carefully regular platelets. slyly even packages cajole quickly. quick
256|17|9145|33.72| boost pinto beans. unusual, slow excuses thrash furiously. carefully pending theodolites wake among the quickly iron
256|2|4423|511.49|ly up the pinto beans. carefully even packages boost finally. bold, express deposits along the fluffily silent instructions na
257|18|5042|391.32|rs sleep carefully against the silent instructions. carefully bold instructions haggle. fluffily pending deposits sleep busily.
257|3|276|612.44|among the packages. thinly special packages sleep. blithely ironic packages are furiously around the furiously even packages. carefully unusual accounts nag bold dolphins. blithely ironic depend
257|18|8951|657.66|final, careful deposits poach fluffily against the permanently pending pinto beans. slyly express platelets us
257|3|6401|510.53|al instructions detect carefully final requests. accounts kindle slyly quickly unusual theodolites. furiously bold deposits about the carefully unusu
258|19|2767|310.17| wake quickly about the furiously regular theodolites. slyly blithe deposits engage blithely furiousl
258|4|6110|473.92|o beans. busily daring pinto beans about the slyly pending dependencies play furiously forges. express, 
258|19|7290|377.76|ole quickly slyly fluffy hockey players. furiously regular packages cajole carefully across the slyly special instructions. bold packages thrash slyly. deposits p
258|4|8527|610.52|ickly bold pinto beans against the fluffily bold foxes are carefully above the quickly special ins
259|20|649|361.81|ide of the furiously fluffy requests. asymptotes was busily past the fluffily silent instructions. permanent, express accounts use slyly against the 
259|5|7418|304.94|ttainments nag blithely against the blithely pending ideas. fluffily unusual pains wake slyly. blithely final requests sleep quickly pendi
259|20|2359|499.52|yly regular dolphins wake. furiously even asymptotes boost quickly. blithely final excuses boost fluff
259|5|5176|12.99|ets about the carefully regular accounts affix against the carefully unusual accounts. final, ironic asymptotes nag slyly fluffily ironic accounts.
260|21|4208|750.83|ts integrate bold instructions. fluffily ironic accounts integrate carefully fluffily quiet theodolites. unusual, final packages
260|6|681|11.99|uriously express pinto beans. carefully regular deposits wake. slyly final dependencies along the ironic, even foxes detect a
260|21|5247|988.81|ites. carefully pending dependencies poach above the final accounts. closely special packages haggle thi
260|6|4944|741.18|onic packages. evenly regular deposits alongside of the carefully blithe dolphins boost always idly regular asymptotes. special, final foxes
261|22|3590|537.09|ss requests wake blithely. ironic theodolites cajole after the furiously silent deposits. carefully slow packages against the requests will sleep slyly across the 
261|7|6312|2.47|carefully packages. pending ideas haggle. special asymptotes boost furiously. quickly pending dinos cajole slyly alongside of the furiously express pac
261|22|9167|747.91|e regular, bold foxes. foxes sleep about the even, regular accounts. fluffily ironic deposits are never slyly ironic accounts; special, express foxes wake furiously. furiousl
261|7|6807|798.56|nusual pinto beans. carefully even deposits affix slyly. final, ironic dolphins solve above the blithely ironic ideas. quickly unu
262|23|6615|11.82|beans. even theodolites wake carefully outside the slyly even foxes. quickly ironic i
262|8|8397|161.89|s. furiously daring requests detect furiously furiously ironic packages. slyly express ideas cajole quickly dependencies; theodolites engag
262|23|6837|822.86|y regular pinto beans. furiously even requests cajole blithely carefully regular theodolites. asymptotes nag furiously. pending fox
262|8|7139|777.88|leep furiously. quickly unusual requests about the regular foxes boost fluffil
263|24|5592|123.18|atelets. even, ironic requests cajole above the st
263|9|2034|617.49|refully final deposits try to wake even, ironic accounts. ideas integrate bli
263|24|6697|655.09|xes affix above the quickly final deposits? slyly special dependencies affix according to the pend
263|9|6421|321.23|ously final requests. regular, unusual accounts haggle fluffily above th
264|25|7115|550.65|xcuses haggle fluffily along the blithely ironic deposits. slyly final accounts sleep asymptotes. furiously pending accounts sleep. doggedl
264|10|6442|239.05|ress theodolites run above the brave, enticing deposits-- idly bold foxes wake blithely. slyly fluffy pinto beans affix furiously close accounts. quickly pending instructions haggle. furiou
264|25|8245|887.54|sts cajole along the slyly final frays! foxes boost about the slyly ironic instructions. carefully bold instructions boost 
264|10|6978|986.71|d detect-- fluffily special ideas haggle across the carefully even foxes. carefully unusual 
265|26|5951|288.42|eful packages. final, regular packages grow carefully blithely ironic ideas. carefully regular requests poach special requests
265|11|3699|565.98|r accounts snooze furiously about the carefully final requests. special instructions maintain quickly final sheaves! slyly regular theodolites despite the furiously final sauternes mold carefu
265|26|2706|72.22|elets alongside of the carefully quiet packages are quietly despite the slyly ironic requests. even, final dependencies cajole blith
265|11|1452|327.52|. regular, even foxes integrate. express somas dazzle. carefully ironic deposits about the slyly express requests are furiou
266|27|2552|262.17|ve the final instructions. carefully ironic foxes wake slyly. quickly ev
266|12|3521|903.57| carefully even requests wake. careful accounts sleep furiously. blithely even pinto beans haggle carefully above the furiously bold deposits. deposits impress carefully blithely even depo
266|27|3955|555.47|wake. blithely ironic platelets integrate quickly final packages! ironic ideas haggle above the carefully pending asymptotes. special dep
266|12|1533|379.56| even deposits haggle final, final warhorses. bold pinto beans integrate slyly. carefully final pinto beans wake above the regular deposits; qu
267|28|9780|796.91|eposits. fluffily special courts cajole blithely blithely even grouches. special, r
267|13|2112|214.65|thogs. furiously ruthless requests sleep fluffily after the even platelets: final excuses play quickl
267|28|9243|478.66|theodolites. boldly final requests boost slyly slyly bold requests. slyly even deposits after the platelets cajole among the pending accounts. furiously express accounts cajole carefully close instr
267|13|5747|111.49|ve to are slyly blithely regular deposits. quickly unusual packages sleep fluffily regular accounts. slyly brave accounts against the regular requests cajole above the slyly pending
268|29|8242|893.67|re furiously regular dependencies. final ideas sleep slyly. permanently regular instructions haggle slyly above the slyly regular 
268|14|532|995.83|ely regular excuses affix carefully above the packages. ironic theodolites around the deposits breach furiously across the furiously even foxes. furiously ironic accounts grow across the fina
268|29|3331|742.57|hely pending foxes among the quickly regular requests affix fluffily ironic asymptotes. final ideas among the final requests s
268|14|6321|962.07|y. even packages nag. blithely final dolphins x-ray bli
269|30|1186|753.85|es according to the furiously ironic deposits sleep s
269|15|3650|750.77| gifts integrate quickly around the fluffily express dependencies. platelets boost. even i
269|30|8833|936.99|inal courts dazzle slyly about the pending requests-- fluffily final deposits across the furiously final instructions are carefully against the furiously even asymptotes. regular 
269|15|2695|874.42| the slyly unusual accounts nag fluffily against the silently unusual packages-- silent packages sleep fluffily. asymptotes cajole across the even, brave packages. carefully even accounts aga
270|1|4380|222.88|ct ruthlessly across the ironic foxes; unusual accounts play. carefully silent instructions haggle blithely across the even platelets. final accounts grow quickly requests. furiously
270|16|8479|851.32|ular ideas cajole slyly. unusual ideas affix fluffily even accounts. final, even accounts thrash furiousl
270|1|5513|559.02|ns cajole-- ironic, even deposits detect fluffily silent, fluffy accounts. always unusual deposits boost sometimes after the accounts. slyly ironic foxes wake carefull
270|16|2408|8.87|usly furiously bold accounts. bold attainments kindle. forges wake blithely enticing requests. pinto beans about the express depths promise c
271|2|2155|442.83|ackages use about the idly special accounts. silent platelets haggle alongside of the unusual, unusual packages. carefully even instructions about the care
271|18|7762|296.66|nal requests are carefully slyly express foxes. regularly even requests 
271|4|3118|202.41|foxes: final dolphins sleep slyly regular instructions. final requests sleep. quickly unusual deposits are furiously-- express hockey players use carefully according to the careful
271|20|8112|504.83|s. carefully regular requests alongside of the even dolphins sleep slyly regular pac
272|3|6032|336.71|yly stealthily pending requests. blithely regular t
272|19|2196|938.89| across the quickly even packages. final requests boost boldly? even deposits cajole in place of the quickly quiet accounts. slyly regular ideas haggle ironic ideas. slyly iro
272|5|9403|764.21|g, even sheaves cajole around the pending, enticing depos
272|21|7284|13.85|y regular deposits along the blithely special foxes cajole slyly pending pinto beans. sly
273|4|1227|299.92|y bold deposits are. bold ideas up the final accounts print furiously carefully quick deposits. depo
273|20|252|26.34|ccounts boost slyly evenly pending foxes. slyly thin packages use fluff
273|6|9810|368.60|haggle furiously slyly even accounts. boldly even deposits detect carefully according to the blithely regular requests. quickly busy requests c
273|22|459|396.65|ng accounts are requests. even, ironic dependencies are slyly. blithely sly deposits nag sly
274|5|9773|406.79|jole blithely evenly regular theodolites. fluffily regular pinto beans according to the ironic accounts wake carefully furiously regular excuses-- packages nag. 
274|21|6020|925.95|gage slyly above the carefully ironic theodolites. even accou
274|7|3194|208.68| after the accounts. carefully special accounts cajole blithely. ironic, regula
274|23|7541|71.95|are express accounts. quickly even foxes solve: slyly even ideas cajole fu
275|6|309|761.60|es play slyly. even pinto beans against the quickly pe
275|22|7630|88.24|ending courts integrate blithely among the ironic requests! blithely pending deposits integrate slyly furiously final packages. slyly ironic theodolites haggle furiously carefully bold pi
275|8|5084|805.78|d theodolites. bold packages among the final, special accounts haggle ironic platelets? fluffily unusual deposits cajole along the quickly ironic instructions. blithely even foxes 
275|24|7063|377.14|osits. carefully even decoys about the final, sly pains sleep accounts. ironic packages
276|7|3238|210.08|l foxes sleep quickly ironic foxes. bold, dogged foxes haggle sly
276|23|2309|612.63|he theodolites. unusual excuses are alongside of the deposits. accounts according to the quickly unusual dolphins sleep slyly pending packages. carefully i
276|9|1966|878.26|xes. blithely express packages doubt among the quickly careful platelets. daringly even deposits sleep quickly caref
276|25|2154|782.37|egular deposits around the special instructions are among the evenly regular excuses. furiously bold dependencies must have to sleep furiously even platelets. furiously even packages abov
277|8|9537|590.56|al packages affix quickly up the carefully unusual theodolites. express requests wake along the furiously final ins
277|24|8662|597.19| instructions boost permanently along the busily ironic warthogs. quietly pending pains sleep carefully ironic 
277|10|5298|210.21|eans are. quickly unusual instructions are blithel
277|26|7264|760.15|are quickly above the fluffily ironic orbits. blithe
278|9|3792|820.45|e throughout the quickly unusual accounts. final accounts boost above the blithely express instructions-- fluffily ironic 
278|25|4046|217.42|eep carefully. unusual, regular requests are according to the special, 
278|11|3228|67.03|lithely ironic accounts. unusual ideas detect. final package
278|27|9568|918.33|heodolites. slyly special pinto beans against the silen
279|10|1729|894.65|yly furiously regular foxes. regular instructions across the furiously pending ideas doubt furiously slyly
279|26|6616|508.76|. carefully ironic accounts wake above the pending, regular accounts. instructions boost evenly ironically sly deposits. ironic, pending
279|12|9390|482.06|ely regular epitaphs haggle furiously for the furiously regular accounts. blithely sly packages cajole blithe
279|28|599|340.51|e quick, express foxes lose packages. slow sauternes against the carefully final foxes cajole furiously according to the fluffily ironic packages. bold accounts cajole finally carefu
280|11|1048|817.32|ily pending packages. blithely silent instructions detect carefully unusual, pending courts. special, unusual packages sleep quietly packages. blithely pending courts sleep ab
280|27|606|641.20|t the quickly even instructions boost foxes. regular accounts cajole above the pending requests. final, regular packages hagg
280|13|828|538.74|e bold requests. carefully even instructions doze silent, silent accou
280|29|3046|863.86|xes sleep. slyly express ideas wake final, dogged ideas. carefully
281|12|935|587.67|dugouts. carefully pending instructions wake silent frays. furiously express theodolites after the always even dugouts should have to integrate blithely around the quickly pe
281|28|1961|15.41|oxes haggle according to the slyly regular requests. final, regular pinto beans was slyly accordin
281|14|7689|496.20|ic instructions cajole after the blithely ironic pinto beans. even dep
281|30|51|99.96|ndencies haggle quickly final sentiments. slyly dogged deposits are furiously ironic dependencies. pinto beans solve slyly after the pending instructions: carefully ironic deposits boost carefu
282|13|17|37.01|beans boost furiously after the ironic excuses. furiously ironic pinto be
282|29|517|869.66| to the quietly bold instructions. carefully ironic deposits by the ironic, regular requests are b
282|15|7339|100.76|among the regularly regular accounts affix furiously alongside of the furiously ironic deposits. slyly thin depos
282|1|6840|428.68|posits. blithely express epitaphs detect furiously special deposits: pending ideas haggle along the blithely pending accounts. carefu
283|14|80|230.32|al accounts. ironic requests use. even forges boost. packages promise slyly slyly silent platelets. ironic, regular foxes cajole slyly special ideas. qui
283|30|3008|125.39|fully bold requests. regular, stealthy platelets about the final dependencie
283|16|484|766.99|ual pinto beans are across the slyly final frays. quietly pending courts sleep slyly regular ideas. excuses nag slyly furiously regular deposits
283|2|7750|757.03|dolites are carefully blithely final deposits. express accounts across the daringly pending deposits use furiously special pinto beans. careful theodolite
284|15|3166|261.10|above the furiously ironic ideas use evenly furiously unusual instructions. regu
284|1|4409|973.64|ickly final deposits mold blithely pending packages! slyl
284|17|3010|402.19|ly special foxes sleep slyly about the furiously express instructions. busily furious package
284|3|2608|588.44|uests. final dugouts wake blithely about the furiously unusual foxes. carefu
285|16|3017|983.75|gular deposits cajole even, final requests. quickly unusual hockey players after the express, special deposits may sleep after the pending, regul
285|2|996|448.03|e furiously after the regular, regular accounts. blithely unusual warthogs around the express instructions maintain quickly after the blithely final deposits! even, express th
285|18|8086|835.59|lyly even asymptotes; slowly pending requests maintain slyly. evenly final theodolites cajole carefully slyly ironic accounts. instructions among the slyly regular sentim
285|4|723|12.85|ges! furiously bold packages try to was. even theodolites play. slyly special packages promise slyly above the slyly ironic requests; final asymptotes are ruthlessly. platelets wake slyly slyl
286|17|1243|376.75|e blithely unusual requests boost above the regular accounts. regular theodolites about the quickly final dolphins
286|3|4231|498.89|s. ironic, regular deposits cajole furiously final pains; blithel
286|19|6267|379.51|ckages nag quickly about the ironic, idle packages. regular platelets snooze slyly slyly ironic asympt
286|5|5285|960.13| quickly. slyly unusual accounts nag furiously; stealthy instructions cajole doggedly alongside of the fluffily final package
287|18|8571|219.71| against the carefully careful ideas. fluffily even requests integrate according to the slyly ironic deposits. blithely pending accounts sleep. final asy
287|4|9210|536.48|ar theodolites above the blithely special theodolites wake according to the regular accounts. slyly unusual deposits across the slyly regular deposits haggle
287|20|1449|787.67|eans are final ideas. regular, regular accounts are furiously according to the regular, special
287|6|9865|674.51|gular warthogs cajole idle dependencies. slyly pending deposits wake furiously quickly regular packages? carefully unusual accounts cajole. blithely pending accounts sleep along the quickly bold r
288|19|1353|915.77|sits integrate carefully quickly pending platelets. carefully special de
288|5|9337|814.16|riously busy requests. quickly pending accounts sleep furiously past the regula
288|21|7811|361.02|lithely at the ironic, pending courts. even, regular requests cajole slyly final asymptotes. even 
288|7|8056|6.69|re carefully special deposits. final pinto beans among the slyly regular
289|20|8148|884.14|er the ironic deposits. blithely regular theodolites integrate around the even multipliers. final, special accounts was after the express deposits. carefully special packages solve quic
289|6|4570|715.63|its integrate carefully slyly ironic frets. blithely express packages along the 
289|22|2659|822.55|carefully regular instructions. pinto beans near the furiously bold depend
289|8|7441|519.98| blithely regular requests: ironic instructions above the fluffily even pinto beans wake carefully along the silent,
290|21|2802|197.07|ts cajole along the ironic ideas! slyly pending ideas again
290|7|5235|670.51|ent sentiments detect quickly blithely silent requests-- slyly brave dolphins sleep slyly. furiously final deposits might are. always regular packages cajole quickly carefully even excuses. qui
290|23|1424|646.67| daring courts sleep thinly. never furious packages at the car
290|9|3125|586.98|ggle regular theodolites; theodolites sleep carefully express ideas. close packages according to the slyly final deposits wake quickly even requests. even courts sleep slyly 
291|22|380|383.56|gular deposits use above the ideas. deposits was furiously. slyly express foxes haggle ideas. carefully express requests wake slyly after the fluffily regular requests. fluffily final foxes detect s
291|8|5571|219.57|o the regular deposits. deposits cajole. final theodolites wake eve
291|24|7165|270.40|its haggle. even, regular dependencies are final, unusual excuses. final ideas boost except the regular dependencies. final packages slee
291|10|9023|338.50|. packages haggle slyly final packages. blithely bold requests alongside of the quickly special deposits cajo
292|23|8086|996.20|n foxes. slyly regular requests are quickly against the stealthy, final dependencies-- furiously final packages along the ironic p
292|9|9673|927.85|carefully sometimes final warthogs. permanently bold requests cajole above the express escapades. quickly ironic requests cajole. furiously express requests
292|25|4133|143.75|idly final instructions. foxes sleep carefully final accounts. deposits can mold slyly boldly unusual packages. carefully e
292|11|2221|597.53|unusual requests haggle fluffily ironic deposits. blithely silent pearls haggle ruthlessly unusual 
293|24|3765|919.92|ke carefully final accounts. slyly ironic requests wake quickly. blithely regular accounts are carefully above the carefully stealthy requests. slyly daring packages after the dependenc
293|10|9232|597.44|ages. furiously final somas sleep slyly alongside of the furiously pending foxes: blithely even ideas cajole carefully deposits. carefully regular tithes sleep alongside of the slyly ironic
293|26|3007|421.32|ts. brave ideas nag special instructions. blithely final frets detect slyly quick, iro
293|12|7704|323.62|efully according to the carefully ironic excuses. accounts wake carefully against the thin requests. furiously pending accounts sleep slyly ironic requests. regular, 
294|25|4958|755.15|l requests about the furiously even frets maintain against the slyly ironic instructions
