PS_PARTKEY | PS_SUPPKEY | PS_AVAILQTY | PS_SUPPLYCOST | PS_COMMENT
201|22|8649|280.98|ainst the furiously even platelets nag carefully across the pending foxes. sly, regular instructions are carefully ins
201|5|2078|340.49| across the quickly special accounts. special accounts are blithely about the fluffily final deposits. silent packages haggle about the ironic packages. blithely ironic deposits boost
201|18|4125|534.11|uctions sleep slyly final theodolites. ironic, regular pinto beans along the sly
201|1|848|947.59| doubt furiously unusual accounts. furiously ironic packages are ironic, even accounts. furiously silent 
202|23|7822|247.44| even pinto beans haggle. carefully ironic accounts
202|6|3182|180.81|uriously stealthy pinto beans along the silent deposits detect quickly about the express requests. slyly thin foxes are quickly. unusual, 
202|19|2720|160.45|ickly for the deposits. quickly pending deposits haggle ironically. slyly final instructions sleep carefully furiously regular attainments. furious
202|2|6202|656.17|symptotes nod. slyly regular requests sleep quickly along the regular instructions. regular accounts alongside of the express packages detect even, ironic deposits. requests cajole furiously abo
203|24|1677|399.16|ll detect slyly across the ironic, even packages. final deposits haggle. even ideas wake ruthlessly above
203|7|3591|582.85| bold instructions hinder ironic, special pinto beans. final deposits x-ray across the regular deposi
203|20|6239|882.46|bout the blithely permanent asymptotes. slyly ironic dependencies haggle slyly against the blithely even deposi
203|3|5644|489.27|ts nag carefully after the even requests. furiously silent accounts cajole. dolphins haggle furiously. carefully ironi
204|25|9265|504.61|ructions. pending, regular deposits around the slyly pending asymptotes sleep slyly regular, express theodolites. fluffily special excuses a
204|8|2203|609.26|lyly. blithely even accounts against the furiously silent instructions are carefully along the slyly ironic theodolites. slyly bold pinto beans caj
204|21|6344|172.65| theodolites. final accounts wake after the quickly even dependencies! furi
204|4|1238|819.14|e slyly quickly permanent accounts; slyly bold requests sleep express requests-- final excuses snooze above the fl
205|26|9942|226.71|onic depths haggle. always final packages wake slyly along the slyly bold gifts. fluffily unusual requests poach quickly. slyly silent 
205|9|7965|427.25|ut the quickly unusual instructions. sly, regular requests haggle blithely blithely regular deposits. dogged deposits haggle quietly above the pending, regular packages
205|22|1974|217.01|ress, final packages hinder blithely special pinto beans
205|5|9207|123.08|leep. slyly pending ideas detect furiously alongside of the silent, regular 
206|27|1961|936.54|hely pending courts wake stealthily final theodolites. furiously busy packages across the slyly unusual accounts wake according to the blithely pending theodolites. quickly fluffy accounts aga
206|10|425|362.30|ial requests. even theodolites haggle furiously. fluffily pending deposits boost blith
206|23|7816|389.88|daringly. slyly regular foxes believe carefully among the final courts. carefully pending instructions are qui
206|6|548|480.04|slyly quickly silent foxes. even depths sleep according to the fluffily pending fo
207|28|9319|335.16|al pinto beans should grow blithely blithely bold tithes. slyly unusual theodolites nag
207|11|3567|810.91|above the quickly bold deposits. furiously pending deposits nag slyly-- furiou
207|24|9711|673.18|the platelets sleep about the ironic deposits. even accounts wake slyly alongs
207|7|7316|557.72|nic instructions sleep furiously despite the carefully unusual packages. ironically
208|29|7366|135.51|ial instructions wake furiously. regular asymptotes haggle fl
208|12|7251|54.46|pinto beans nag fluffily special ideas. carefully ironic decoys cajole carefully slyly even excuses. regu
208|25|5255|474.75|s cajole quickly. fluffily even requests use furiously above the quiet foxes. fluffily ironi
208|8|7066|309.80|ke. ironic, express instructions with the slyly bold packages haggle carefully bold,
209|30|7176|236.77|otornis wake slyly about the quickly special asymptotes. foxes believe fluffily above the ironic requests. express accounts solve across the express pinto beans. slyly pending foxes run r
209|13|3344|575.01|he quickly regular deposits. carefully regular requests along the requests lose according to the even pinto beans. express courts are slyly 
209|26|5580|81.80|en instructions. carefully regular theodolites solve furiously. pending, regular asymptotes x-ray blithely requests. pinto beans cajole slyly. carefully bold sentiments haggle carefull
209|9|1513|507.38|fily regular pinto beans? blithely regular dependencies cajole ca
210|1|6774|267.01|ermanently final instructions breach across the idly pending theodolites. quickly pending
210|14|8671|377.95| regular packages? final, bold pinto beans use slyly special pac
210|27|6596|817.36|nt accounts lose at the furiously bold platelets. carefully regular pinto beans use. special packages among the d
210|10|4516|259.05|yly bold requests are blithely. packages outside the furiously final ideas x-ray daringly among the even packages. accounts mold blithely about the pending notorn
211|2|4572|475.68|olites haggle slyly according to the regular, even
211|16|6045|856.97| ironic multipliers sleep. furiously express requests wake quickly. regular dependencies along the dinos sleep after the epitaphs. quietly unusual deposits haggle blith
211|30|6901|707.01|final pinto beans affix quickly express warthogs: regular pinto beans from the carefully ironic requests cajole stealthily across the depen
211|14|4247|751.41|tes. warhorses must sleep against the slyly express accounts. special requests according to the carefully regular packages are slyly
212|3|1040|718.90|s along the courts use above the pending packages; pending
212|17|6519|778.38|sly except the fluffily ironic platelets. final deposits serve slyly silent requests. fluffily express dependencies boost. slyly final requests 
212|1|6217|426.19| accounts. carefully even requests along the blithely silent deposits boost among the regular, unusual sauternes. blithely regular packages 
212|15|9266|318.74|y. furiously even deposits are. fluffily unusual accounts nag fluf
213|4|3959|565.71|uffily blithely special requests. even, unusual instructions sleep: requests
213|18|8685|591.93|epths use carefully at the bold, even theodolites; boldly final ideas wake fluffily final requests. furiously iro
213|2|9296|623.44|nal deposits are furiously final somas. ironic realms across the fluffily regular dependencies sleep slyly never special packages. slyly even requests wake fluffily final attainments? furiously regu
213|16|9377|797.64|s? special instructions wake carefully according to the slyly regular accounts. 
214|5|2244|403.15|furiously bold ideas wake furiously across the foxes-- even accounts cajole across the even pinto beans. quickly
214|19|5174|719.69|asymptotes against the regular packages wake after the pending packages. packages cajole carefully ironic, special packages-- furiously expr
214|3|7901|17.50|excuses sleep slyly among the regular forges. final theodolites along the furiously unusual ideas kindle about the final instructions. idle deposits sleep blithely quietly express ideas. 
214|17|6358|646.92|s; blithely regular requests boost among the slyly regular accounts. doggedly quiet deposits integrate furiously. foxes wake stealthily. special, ironic pinto beans integrate. fl
215|6|1710|765.63|ect across the fluffily bold deposits. furiously ironic instructions across the regular requests are
215|20|290|932.70|ns. bold accounts x-ray blithely furiously regular packages. daring, expr
215|4|3754|636.10|dolites. carefully ironic packages nag? special theodolites use furiously. finally 
215|18|7130|838.57|e decoys. quickly ironic packages are blithely regula
216|7|5429|142.97|inal, bold theodolites. silent packages above the evenly regular decoys sleep slyly pending theodolites. even pinto beans about th
216|21|9076|502.55|ove the furiously pending foxes. ironic, permanent instructions cajole carefully among the slyly 
216|5|6245|25.22|sits boost across the furiously regular pinto beans! regularly final dinos sleep. platelets are furiously b
216|19|3277|528.02| sublate fluffily above the quickly special pinto beans. regular accounts nag among the final foxes. furiously even packages wak
217|8|20|479.17| final instructions wake according to the furiously express theodolites. boldly final asymptotes haggle quickly. careful, ironic ideas hag
217|22|3036|714.36|ncies are for the slyly bold realms. quickly express frays wake accounts. slyly ironic instructions sleep blithely during the slyly final package
217|6|875|463.83|inal ideas lose against the carefully unusual deposits. even dolphins are about the blithely enticing 
217|20|9247|637.64|y to wake at the packages. regular theodolites boost furiously furiously ironic r
218|9|3896|622.16|e. furiously regular packages above the accounts sleep pending packages. pending accounts haggle carefully arou
218|23|4848|257.48| carefully. fluffily unusual ideas cajole blithely above the fluffily fluffy instructions. ironic accounts cajole slyly carefully regular accounts. slyly final accounts use quickly. blithely
218|7|1431|55.36|ncies. pending, regular grouches haggle carefully furiously busy accounts. blithely regular deposits boost quickly along the slow foxes. regular packages wake after the furiously regular instructio
218|21|3941|568.24|refully silent dependencies sleep after the platelets. slyly idle requests according to the blithely even pinto beans cajole across the final ideas. slyly bold 
219|10|2369|168.95|fully regular packages? requests nag carefully regular deposits. fluffily regular requests haggle furiously quickly pendi
219|24|491|658.50|y about the ironic ideas. even deposits haggle stealthily fluffily busy instructions: blithely final requests cajole across the slyly final depths. slyly unusual requests a
219|8|5116|580.18|even requests cajole fluffily after the ideas. even, 
219|22|145|1.43|carefully final dependencies cajole. bold foxes haggle. pending deposits use bold, express deposits. platelets are. slyly unusual c
220|11|2941|341.13|gle furiously furiously final foxes. furiously unusual accounts 
220|25|2118|396.71|inal packages haggle fluffily against the ironic foxes. bold, final ideas affix stealthily slyly busy ideas. slyly final re
220|9|6654|322.05|the furiously final packages. accounts haggle blithely. requests use furiously. furiously ironic deposits sleep across the carefully final foxes. ironic asymptotes 
220|23|8767|297.83|ven pinto beans. blithely express requests sleep. regular, unusual ideas cajole fluffily. fluffily pending packages sleep furiously around the regular foxes. blithely silent depo
221|12|1469|916.33| haggle? silent, pending foxes boost silently excuses. blithely bold instructions nag. regular, regular excuses dazzle carefully even id
221|26|9153|324.88|sly silent theodolites wake around the unusual, ironic deposits. even, idle pinto be
221|10|5484|898.37|uches. furiously ironic accounts sleep carefully against the blithely bold accounts. slyly regular depo
221|24|2849|80.70|s cajole. platelets sleep blithely after the final accounts. pending, bold packages alongside of the
222|13|8085|967.81| ironic platelets? blithely even packages cajole regularly after the bold foxes. dependencies nag carefully about the platelets. quickly regular attainments wake slyly above the requests. quick
222|27|8065|422.77|ual pinto beans. ironically final theodolites along the regular, express platelets are blithely between the close
222|11|7808|734.78|thely across the pinto beans. idle, special accounts after the express, express packages haggle blithely blithely regular dolphins; c
222|25|8855|926.10|es about the closely ruthless requests cajole permanently blithely even packages. deposits sleep stealthily hockey players. finally ironic packages nag. 
223|14|582|693.87|n deposits. slyly regular instructions according to the blithely unusual instructions serve across the hockey players. 
223|28|1488|735.88|al deposits are slyly along the furiously final excuses: slyly express deposits wake blithely quickly pending ideas. even t
223|12|259|523.37|ongside of the slyly express deposits. foxes use furiously quiet accounts. furiously pending notornis are slyly after the furiously ironic packages. regular, bold accounts detect. slyly regu
223|26|4893|287.24| regular deposits doubt. furiously special requests wake furiously final foxes. slyly quick requests wake. carefully enticing ideas cajole slyly. slyly final dolphins haggle furiously slyly spe
224|15|7119|745.97|ole among the quickly ironic packages. carefully even frays doze. slyly pending ideas detect fluffily slyly final theodolites.
224|29|7374|252.76|ven packages sleep fluffily above the blithely bold deposits. carefully unusual packages about the blithely express deposits haggle blithely furio
224|13|1227|673.82|usly regular accounts. fluffily final instructions according to the slyly ironic theodolites poach blithely final frets. daringly ironic requests boost blithely darin
224|27|9097|404.64|dolites nag carefully across the unusual, regular foxes. stealthily ironic dolphins use sl
225|16|6101|775.45|ess pinto beans are slyly above the final theodolites. blithely final grouches are quickly since the deposits. regular account
225|30|4421|116.17|s above the requests. quiet, silent asymptotes across the pending theodolites haggle
225|14|5365|617.35|arefully regular dependencies along the slyly regular ideas wake about the carefully unusual d
225|28|2137|276.11|ways special packages. ironic pearls around the furiously even packages are ac
226|17|9130|465.81|st the furiously regular theodolites. quickly regular notornis promise. regularly furious packages wake quickly. closely ironic fo
226|1|966|931.43|ourts wake slyly. regular, ruthless pains print carefully after the ca
226|15|2680|343.14|y ironic ideas. express, final instructions boost blithely according to the carefully special accounts. ironic requests cajole
226|29|4772|58.38|lent sentiments solve blithely pending requests. furiously special platelets haggle quickly between the final packages. furiously brave ideas haggle blithely slowly thin accounts. slyly even 
227|18|8809|453.33| quickly around the fluffily bold dolphins. ironic accounts sublate blithely ac
227|2|1408|877.71|y. slyly unusual accounts x-ray blithely blithely regul
227|16|6607|472.58|ly even requests. furiously final deposits wake slyly above the requests-- quickly
227|30|5426|736.86|kages unwind ironic, regular requests. quietly final deposits haggle carefully along the quickly pending asymptotes; busily ironic instructions
228|19|831|862.15|al courts sleep. regular requests haggle slyly even deposits. furiously pending requests sleep 
228|3|235|727.11|ording to the fluffily express deposits. even, final requests despite the doggedly ironic 
228|17|6712|976.89|hely against the ironic foxes. blithely busy deposits about the even asymptotes x-ray carefully along 
228|1|6694|133.30|ven requests poach furiously along the furiously express packages. furiously even requests dazzle slyly. blithely special foxes are carefully blithely even accounts. regular, unusual dolphins hag
229|20|4074|835.21|, ironic requests. ironic, regular pinto beans about the special deposits haggle along the ideas. packages wake fluffily final accounts. depo
229|4|4781|497.84|ep final frays. final, final packages wake furiously slyly permanent asymptotes. final packages use carefully. permanently regular deposits affix quickly amo
229|18|2241|820.67|out the final requests. carefully ironic platelets will have to affix furiously toward the carefully special dolphins. blithely stealthy deposits aff
229|2|5560|984.71| stealthily final courts. furiously even packages are slyly. ideas after the slyly final ideas sleep blithely r
230|21|5361|723.71|ully final pinto beans haggle carefully after the regular ideas. regular deposits accordi
230|5|7726|634.61|across the blithely special dependencies. fluffily silent theodolites cajole furiously bold forges. special foxes cajole. carefully even deposits wake permanently against the 
230|19|1549|752.70|sts wake idly after the quickly bold accounts. carefully pending packages haggle blithely. express instructions cajole quickly. furiously regular asymptotes use carefully aroun
230|3|4949|491.83|e. quickly final deposits are carefully. quickly pending packages after the unusual, even accounts are even platelets. final, silent requests
231|22|6305|695.86|s are excuses: accounts sleep? quickly even requests 
231|6|4995|253.34|uriously against the bold accounts. slyly regular packages
231|20|5360|308.95|yly ironic accounts affix blithely. slowly regular ideas nag regular requests. deposits against the carefully regular instructions boos
231|4|803|971.24|rash. slyly blithe ideas detect furiously. fluffily even deposits use slyly slyly unusual frets. carefully even dependencies 
232|23|5028|42.14|e slyly regular foxes. carefully ironic pinto beans according to the packages are carefully about the requests. quickly final
232|7|1108|240.70|kages haggle slyly-- deposits sleep above the regular grouches. express pinto beans nag fluffily. idly ironi
232|21|9154|716.37|yly express accounts. quickly unusual excuses boost carefully across the carefully final instructions? furiously unusual instructions boost fluffily bold theodolite
232|5|1828|266.84|into beans wake across the pending pinto beans. even instructions haggle furiously bold accounts. bold theodolites boost furiously quick instr
233|24|2689|446.29|usly special deposits: busily express theodolites cajole fluffily after
233|8|8231|524.51|carefully ironic sheaves. slyly regular deposits would wake furiously about the accounts? final dinos use. ruthlessly 
233|22|444|372.96|pecial requests. ironic instructions alongside of the furiously unusual theodolites sleep quickly slyly regular dependencies. c
233|6|3009|767.62|ses. ironic ideas use fluffily. fluffily fluffy accounts boost furiously. ironic packages cajole carefully bli
234|25|3807|438.37|ly regular accounts unwind above the express excuses. furiously final requests nag. bold platelets cajole across the pinto beans. carefully final courts wake slyly bold plat
234|9|90|194.46|ackages. slyly pending foxes haggle stealthily pending deposits. even dolphins hin
234|23|367|826.04|t the regular, final packages snooze blithely against the furiously ironic pinto beans! special, express theodolites are careful
234|7|600|252.58|ncies sleep carefully unusual orbits. platelets sleep furiously after the ironic sentiments. bold epitaphs print. blithely r
235|26|9292|610.14|pinto beans. quickly dogged requests doze ironic requests. furiously ironic requests wake. blithely even pinto beans wake about the furiously quick accounts; even ideas boost above the slyly p
235|10|3827|96.25|t quickly. carefully close platelets sleep carefully through the b
235|24|3030|493.88|r dolphins haggle furiously. careful, special ideas are blithely after the bold platelets. slyly bold tithes
235|8|9681|100.94|ix about the regular theodolites. furiously special packages sleep blithely across the slyly regular accounts. carefully ironic reques
236|27|3270|423.71|hy requests haggle slyly. ideas cajole around the furiously pending instructions. furiously brave pin
236|11|5757|636.84|. special, unusual sentiments boost fluffily slyly bold foxes. blithely regular excuses are furiously; slyly even deposits wake furiously boldly final instructions. bold 
236|25|4959|192.44|lly express, regular waters? blithely even ideas mu
236|9|2932|834.00|sy deposits cajole slyly unusual, pending deposits. evenly busy multipliers could integrate silently. theodolites affix fluffily fluffily regular accounts. deposits use slyly unusual dolphin
237|28|7643|255.01|ounts haggle pending packages. furiously express theodolites b
237|12|5360|438.19| quickly final, even accounts. blithely regular dolphins grow quickly quickly ironic requests. furiously i
237|26|2263|196.32|e carefully. fluffily silent accounts use. blithely regular ideas wake furiously. carefully ironic accounts boost
237|10|5241|67.83|e furiously. fluffily regular foxes use fluffily except the furiously ironic platelets. accounts instead of the blithely express pinto beans integrate theodolites. regular, pendi
238|29|7285|454.34|ecial, regular packages nag. carefully even deposits cajole blithely slyly final foxes. deposits haggle slyly. stealthily pending th
238|13|1615|999.92|riously ironic foxes detect fluffily across the regular packages
238|27|7504|556.95|ns. slyly even deposits cajole furiously blithely even theodolites. blithely express accounts boost quickly express request
238|11|9231|171.18| to the final requests. slyly even accounts among the regular foxes should wake slyly even requests. permanently pending packages integrate enticingly
239|30|8638|155.22|nusual accounts use furiously. furiously even attainments wake. quickly regular packages hang slyly fluffily final deposits. ironic deposits cajole. 
239|14|3755|570.10| instructions are theodolites. ironic, ironic foxes about the packages mold blithely bold requests. slyly regular accounts affix according to the blithely special instruc
239|28|6890|411.32|lyly bold packages boost fluffily ironic packages. regular, final deposits mold slyly 
239|12|4889|168.50|ickly silent accounts use final ideas. fluffily pending asymptotes across the quickly silent foxes affix slyly alongside of the f
240|1|6917|91.89|kages-- fluffily bold depths cajole against the fluffi
240|15|4238|192.43|are. blithely even foxes are doggedly along the caref
240|29|1972|571.34|fily regular gifts. express ideas are furiously whithout the final notornis. carefully regular instr
240|13|1831|243.03| instructions. bold deposits against the quickly regular instructions nag pac
241|2|1907|876.95|ross the furiously even pinto beans wake slyly about the carefully bold foxes. blithely pending courts among the furiously unusual platelets might nag blithely quickly regular packages. closely pen
241|17|6274|844.49|furiously about the busily fluffy requests. regular deposits serve carefully after the express excuses. slyly 
241|2|3003|751.81| cajole furiously bold, even deposits. pending, bold accounts are ev
241|17|60|520.41|old ideas. furiously final packages are furiously slyly express accounts. furiously final asymptotes wak
242|3|6454|536.50|yly slow ideas along the even packages wake carefully up the bold, ironic instructions.
242|18|394|97.24|packages cajole slyly against the blithely special dependencies. furiously even excuses along the slyly sly de
242|3|2514|208.39|ckages. permanent, even warhorses cajole blithely after the final accounts. quickly pending packag
242|18|6902|147.39| sleep. slyly brave foxes lose according to the express foxes. idly express platelets across the carefully even dependencies are ev
243|4|1961|817.56|y across the ironic deposits. ironic accounts boost. silen
243|19|8930|618.10|pecial ideas. stealthy asymptotes use fluffily slyly ironic deposits. blithely unusual accounts haggle carefully. regular theodolites sublate furiously final deposits. quickly final package
243|4|3830|886.99|es. furiously bold foxes are slyly ironic, regular
243|19|3272|641.29| accounts haggle permanently furious dependencies. quickly pending hockey players haggle accounts. blithely even instructions haggle. furiously final dependencie
244|5|5942|148.84|ag according to the quickly even packages. carefully final depos
244|20|4940|293.62|deposits. packages across the fluffy deposits use blithely above the quickly final packages. furiously regular ideas detect. even, bold instructions thrash even requests: regular
244|5|1352|978.74|n platelets integrate. furiously stealthy foxes believe fluffily. furiously final excuses above the furiously unusual packages boost quickly careful
244|20|8850|257.00|final ideas; dolphins are slyly carefully regular accounts. regular, even foxes are quickly throughout the final c
245|6|6034|995.56|. carefully ironic packages promise slyly. ironic, regular deposits about
245|21|3533|187.40|inst the furiously bold asymptotes; depths nag slyly across th
245|6|9116|79.54|asymptotes sleep closely regular pinto beans. regular, final accounts use blithely between the express requests. carefully regular asymptotes cajole carefully blithel
245|21|5694|407.35|press accounts. pending deposits haggle slyly agai
246|7|6561|426.60|uickly unusual requests at the regularly express instructions doze carefully final 
246|22|3607|194.36|thely after the carefully quick accounts. quickly final accounts cajole throughout the packages. slyly final ideas cajole. carefully unusual deposits nag furiously a
246|7|7493|170.68|posits integrate slyly across the furiously even packages. fluffily regular asymptotes against the carefully special accounts poa
246|22|8359|645.45| along the bold packages. ideas haggle furiously blithely even requests? regular packages use quickly according to the dogged dependencies. furiously final ideas according to the carefully even 
247|8|3492|58.15|ckly bold requests. pending dependencies cajole according to the final accounts. stealthily pending requests sleep furiously ironic ideas. deposits after the carefully ironic accounts are alo
247|23|9811|479.85|nically about the carefully unusual requests. fluffily regular packages haggle carefully dugouts. furiously final re
247|8|7397|143.39|he furiously special foxes. ironic packages integr
247|23|9639|650.32| requests sublate quickly idly regular theodolites. quickly ironic requests alongside of the
