PS_PARTKEY | PS_SUPPKEY | PS_AVAILQTY | PS_SUPPLYCOST | PS_COMMENT
294|11|5459|642.44|n pains. regular deposits across the blithely even excuses are carefully bli
294|27|2954|387.79|ly pending theodolites. regular requests are quietly furiously regular fo
294|13|8698|324.37|y bold deposits sleep furiously carefully regular deposits. ideas about the blithely ironic ideas sleep furiou
295|26|2911|273.94|ding accounts. pending, unusual attainments haggle furiously. blithely permanent theodolites use carefully. regular accounts boost fu
295|12|5745|860.51|he quickly express ideas boost blithely ironic accounts-- furiously final packages nod blithely ironic, final theodolites. furiously ironic instructions wake blith
295|28|9953|123.33|sly-- pending, slow foxes among the carefully bold packages hag
295|14|2157|45.25|eep carefully around the packages. fluffily final requests wake blithely alongside of the notornis. ironic, express packages doze ironic, regular plate
296|27|8081|600.92|ntegrate. slyly silent packages nag furiously. qu
296|13|6040|954.78|er the carefully pending accounts cajole carefully alongside of the ironic accounts. quickly blithe pinto beans haggle furiously. stealthily special dependencie
296|29|14|175.09|uickly express requests. furiously express packages are furiously against the fluffily careful saute
296|15|6192|874.52|uffily even theodolites according to the slyly blithe accounts cajole about the 
297|28|3869|918.93|oss the blithely ironic ideas. even pinto beans haggle. permanent braids boost
297|14|3206|980.58| carefully about the blithely regular requests. furiously final dependencies haggl
297|30|2952|281.94|into beans. regular decoys above the quickly unusual requests s
297|16|8465|439.74|eposits sleep quickly across the quickly even accounts. blithely pending accounts sleep slyly. pending ideas boost. deposits boost after the slyly final depende
298|29|9804|314.49|nst the regular, furious platelets. regular packages cajole. ironic, pending ideas sleep slyly ironic excuses. requests cajole? blithely express req
298|15|7273|210.43|deposits haggle fluffily. final packages sleep furiously unusual frets. regular, regular excuses haggle slyly carefully ironic accounts. regular ideas unwind slyly acco
298|1|5321|380.94|longside of the close foxes dazzle slyly unusual requests. pinto beans cajole at the fluffily final requests: even platelets sleep quickly express asymptotes. blith
298|17|1664|18.20|er the slyly silent accounts. daringly special depos
299|30|4365|438.80|odolites. carefully regular packages solve against the furiously bold excuses: deposits w
299|16|1747|489.79|etimes special frays. unusual accounts boost blithely. even foxes sleep. furiously ironic dependencies sleep f
299|2|2035|248.11|ithely final foxes cajole. blithely pending packages grow slyly special, ironic platelets. fluffily pending dept
299|18|590|444.06|ly. final, final requests across the forges wake slyly after the sauternes. slyly final pinto be
300|1|6518|924.41|s the special packages. daringly silent somas are blithely even, unusual pinto beans. silently ironic pinto beans cajole furiously unusual requests. furiously even deposits impress. pendi
300|17|7010|190.59|ual pinto beans. blithely express foxes unwind carefully instead of the accounts. ironic accounts boost slyly regular excuses. quickly unusual courts sleep furiously. fluffily even pinto beans h
300|3|7118|743.78|sts wake carefully regular, pending pinto beans. unusual foxes wake slyly among the ironic, reg
300|19|2714|339.22| carefully regular deposits. evenly silent pinto beans integrate. even, regular packages are furiously against the even requests. fluffily special asymptotes across the slyly
301|2|7050|251.11|attainments doze fluffy deposits. carefully pending pinto beans cajole slyly pending, pending ideas. carefully silent theodolites sublate fluffily around th
301|19|3908|877.38|s. furiously enticing packages lose quickly slyly ironic gifts. asymptotes do dazzle carefully final, bold packages. furiously silent asymptotes sleep blithely final asymptotes. requests are. foxe
301|6|2880|954.20|efully bold deposits cajole blithely silent warhorses. furiously even pinto beans sleep blithely instructions. quickly pending requ
301|23|8169|335.10|carefully. blithely express packages hang about the boldly silent packages. final, final instructions boost slyly. slyly express deposits cajole slyly regular instructions. blithely
302|3|6118|885.76| are regularly. furiously regular requests during the sl
302|20|9419|38.78|d platelets detect furiously across the slyly even packages. slyly brave requests sl
302|7|9134|764.04| dependencies sleep furiously around the special, even instructions. furious, ironic f
302|24|3921|148.56|xpress pinto beans. bold, regular theodolites cajole slyly against the carefully even asymptotes. final, ironic excuses haggle furious
303|4|9794|499.32|er the final instructions kindle final, pending ideas. blithely final excuses across 
303|21|8459|717.65|symptotes. Tiresias affix slyly. bold, regular asymptotes boost quickly according to the final, regular courts. regular, ironic pinto beans are blithely carefully ironic accounts. platelets s
303|8|2331|682.84| the furiously ironic requests. ironic, final requests haggle carefully beneath the hockey p
303|25|3092|106.23|blithely ironic accounts. platelets integrate slyly about the blithely final sauternes. boldly final accounts cajole furiously after the idly final deposits. quickly final theodolites wake finally 
304|5|644|419.29|y final asymptotes! carefully regular requests wake blithely. furiously final theodolites detect carefully across the slyly express excuses. regular requests are. carefully special decoy
304|22|1696|315.96|press bold instructions. carefully final ideas haggle aft
304|9|851|944.89|ies. carefully pending deposits after the blithely special instructions use final accounts. doggedly exp
304|26|4334|770.75|tructions. final deposits cajole. quickly even packages shall have 
305|6|2828|105.28|ronic deposits haggle quickly blithely express packages. bold, ironic packag
305|23|1846|428.85|uctions above the foxes sleep carefully at the carefully final accoun
305|10|2863|147.36| sleep carefully. deposits cajole furiously. even dinos haggle blithely slyly even packages. ideas haggle. unusual, even deposits are boldl
305|27|2758|442.56|ilent attainments. slyly final packages cajole. carefully even foxes integrate according to the ironic deposits. slyly regular theodolites w
306|7|3429|671.11|foxes are among the furiously bold foxes. asymptotes about the express requests thrash about the regular packages. carefully regular deposits haggle fluffily! furiously even requests are 
306|24|9417|789.02|gular accounts hang against the dolphins. blithely regular deposits nag blithely after the fluffily unusual packages. carefully even deposits cajole quickly. bli
306|11|6950|405.25|counts promise above the quickly special foxes. accounts are slyly regular asymptotes. furiously special instructions print 
306|28|7651|33.95| furiously silent deposits above the ironic accounts haggle carefully carefully ironic foxes. close platelets haggle furiously slyly ironic deposits. carefully ironic requests around the final acc
307|8|1809|354.10|sual ideas. carefully ironic epitaphs cajole furiously among the closely express asymptotes. final asymptotes detect. furiously bold instructions sleep sly
307|25|4455|578.21|deas. slyly final foxes haggle fluffily furiously bold accoun
307|12|259|867.98|al packages above the blithely pending theodolites kindl
307|29|8178|902.14|nto beans. deposits along the express, ironic deposits haggle beneath the blithely ironic ideas: even, unusual platelets are. excuses according to the unusual, special dep
308|9|1421|511.71| haggle. fluffily final ideas sleep doggedly. silent, final accounts wake quickly. blithely regular deposits sleep carefully 
308|26|264|169.31|lyly even accounts. ideas after the carefully pending deposits haggle after the quickly special pinto beans. carefully ironic accounts haggle furiously regular instructions. f
308|13|4206|639.67|riously bold excuses print doggedly bold requests. carefully careful attainments engage; even sheaves according to the slyly bold packages sleep blithely about the carefully
308|30|3473|835.30|ely even pinto beans? final requests boost carefully along the regular accounts
309|10|6409|12.41|gside of the packages: carefully unusual forges impress slyly sometimes regular accounts. slyly special platelets might wake furiously according t
309|27|1870|989.46|deposits cajole carefully unusual pearls. packages wake blithely fluffily pending excuses. slyly express deposits after the thinly unusual theodolites cajole slyl
309|14|5619|635.09|y slyly regular packages. doggedly pending requests solve. carefully unusual packages sleep regula
309|1|3596|719.58|uriously regular excuses. instructions sleep. blithely express accounts thrash. express dolphin
310|11|5820|251.97|he blithely ironic deposits. furiously express pinto beans wake across the blithely regular deposits. carefully unusual deposits against the permanently unusual requests sleep blithel
310|28|9797|378.30|e blithely bold instructions. unusual, silent ideas sublate blithely. pending packages are furiously along the final, ironic packages. slyly bold packages sleep furiously according to the f
310|15|2896|696.04|among the carefully quiet asymptotes haggle quickly blithely dogged requests. bold deposits affix carefully alongside of the final accounts. slyly regular packages are after the boldly bold dep
310|2|786|185.63|gle blithely pending waters. regular requests cajole carefully pending requests. fluffily unusual packages should wake blithely bravely ironic requests. regular, express r
311|12|799|256.71|around the regular, regular packages. furiously express packages cajole even
311|29|2464|62.15|s. blithely unusual deposits integrate. carefully regular pinto beans wake slowly furiously final pinto beans. slyly even pinto beans are about the
311|16|3560|899.72|c instructions. deposits wake furiously furious do
311|3|7092|813.30|en theodolites affix according to the furiously final packages. blithely ironic pac
312|13|2222|964.88|to beans. bold packages wake quickly regular, regular dolphi
312|30|2789|3.01|the ironic accounts. busy dolphins dazzle among the furiously express ideas. ironic asymptotes will h
312|17|4410|900.66|uffily ironic dolphins affix slyly according to the carefully unusual notornis. furiously ironic dependencies cajole; furiously 
312|4|608|715.73|tructions. express instructions integrate carefully; carefully special accounts cajole carefully according to the ironic, unusual foxes. regular deposits boost after the ironic,
313|14|3787|413.31| alongside of the furiously unusual instructions. pending, special foxes cajole slyly. special ideas sleep slyly. slyly regul
313|1|3617|656.08|counts use after the fluffily regular accounts. final dolphins sublate. blithely pending packages haggle finally furiously ironic requests; sly
313|18|2264|975.79|ly unusual deposits against the blithely even instructions sleep furiously regular, regular ideas. even, regular i
313|5|2574|670.56|s the even, daring deposits mold accounts. carefully express accounts haggle fluffily blithely pending ideas. blithely final courts haggle blithely about the regular theodolites. quickly
314|15|8985|613.18|ular pinto beans hang. quickly regular requests integrate slyly quickly regular dolphins. fluffily special theodolites cajole unusual accounts. furiously regular excuse
314|2|910|188.83|es nag across the enticing packages. carefully special instructions haggle slyly after the blithely even packages. pending, unusual asymptotes wake furiously against the
314|19|573|85.10|e regular deposits. furiously even excuses solve quickly. ironic deposits boost furiously along the blithely bold asymptotes. furiously special deposits haggle slyly among the regular instruct
314|6|4839|923.67|ough the slyly special theodolites. regular Tiresias wake across the final, regular deposits. furiously final ideas breach. unusual 
315|16|8068|696.12|e instructions are according to the furiously unusual asym
315|3|1267|608.15| accounts boost before the special requests. daringly ironic packages are after the carefully ironic epitaphs. bold, special deposits nag. even, even excuses affix slyly. quickly permanent platelet
315|20|5609|536.31|beans detect furiously. even, express instructions cajole even deposits. caref
315|7|8071|931.74|l instructions: dependencies among the excuses believe fluffily after the carefully unusual ideas. regular
316|17|8732|456.59|. final decoys above the furiously ironic accounts grow above the carefully even multipliers. ironic dolphins cajole quickly bold dolphins. final deposits eat furiously permanent excuses. regu
316|4|8839|823.03|e furiously pending packages. unusual packages mold quickly carefully fi
316|21|8752|591.79|sts hinder carefully. furiously unusual deposits haggle fluffily 
316|8|8192|325.50|y carefully final asymptotes. slyly special foxes are fu
317|18|3554|332.00| asymptotes doze fluffily according to the furiously pending theodolites. carefully unusual deposits are among the fluffily final instructio
317|5|6084|633.24|ular ideas before the accounts use carefully across the requests. unusual, pending accounts cajole blithely according to the slyly final
317|22|5004|732.48|sly even ideas. carefully bold dependencies nag blit
317|9|52|319.63|ideas solve escapades. unusual foxes use according to the regular accounts. carefully special packages believe blithely after the pending requests. quickly pending ide
318|19|9115|625.00| excuses. carefully ironic excuses are slyly across the decoys. carefully special foxes boost whithout the furiously regular requests. care
318|6|4020|972.74|y according to the bold requests. special instructions boost carefully furiously regular excu
318|23|9011|272.65|onic packages will have to boost carefully above the ruthlessly quick ideas. slyly special accounts are slyly. carefully ironic instructions boost. slyly pend
318|10|2036|209.06|p carefully furiously express accounts. carefully even requests across the pending excuse
319|20|9918|465.97| ruthlessly quickly silent requests. quickly regular accounts wake furiously. slyly bold accounts wake along the carefully final fox
319|7|8816|606.95|slyly. quickly final foxes are slyly ironic excuses. ironic packages among the special instructions run quickly against the final, expre
319|24|7694|326.82|ets. regular, even deposits sleep theodolites. even foxes dazzle carefully after the slyly even excuses. ironic pinto beans are carefully unusual accounts. quickly ironic instructions after the
319|11|2417|557.91|ieve ironic asymptotes. blithely final accounts use. bold, special foxes nag never alongside of the blithely quiet foxes. enticingly close packages against the even, regular escapades boost
320|21|1322|324.25|use quickly. even requests are slyly permanently unusual platelets. final accounts after the packages impress slyly according to the excuses. regularly regular deposi
320|8|9604|309.83| deposits. slyly daring ideas haggle pending, regular platelets. final requests integr
320|25|7644|663.54|slyly. regular foxes after the quietly even requests grow above the quickly bold packages. carefully pending packages affix slyly fin
320|12|1129|433.78|after the slyly final deposits solve slyly after the pending asymptotes. theodolites maintain always after the ironic packages. furiously pending deposits boost furiously abo
321|22|2538|42.75| ironic pinto beans. unusual, regular excuses hang boldly furiously final grouches. blithely busy reque
321|9|429|466.22| foxes haggle ironic instructions. slyly ironic deposits toward the regular deposits sleep final deposits. regular packages haggle slyly near the blithely e
321|26|5325|833.34|d pinto beans. even, idle deposits wake. carefully regular deposits nag blithely even attainments. fluff
321|13|5778|46.51|y. slyly ironic patterns about the carefully unusual packages use thinly stealthy requests. thin accounts unwind ironic foxes: blithely pending deposits cajole 
322|23|7488|700.81|deposits use slyly ironic tithes. regular, close requests are. slow dependencies cajole against the daring, 
322|10|808|410.61|esides the silently final excuses cajole after the slyly even pinto beans. blithely ironic packages wake blithely. even courts sleep fluffily after the fluff
322|27|9986|190.97|the platelets wake furiously somas. packages use express, idle requests. unusual foxes haggle boldly behind the unusual deposits. fluffily stealthy dec
322|14|6413|134.72| affix quickly express, ruthless packages. furiously special deposits was 
323|24|7168|784.33|kages after the special accounts use always furiously silent packages. ironic, unusual instructions affix blithely even asymptot
323|11|2470|574.84|lar ideas was blithely across the express packages. quickly regular ideas ca
323|28|4158|131.93|theodolites about the ironically regular deposits use furiously express, ironic packages. quickly unusual warhorses wake bold, special cour
323|15|7782|862.38|eas. special foxes sleep. accounts eat slyly across the furiously silent ideas. carefully special requests among the ironic f
324|25|8571|575.93|usly ironic ideas along the quickly final packages cajole blithely 
324|12|1057|473.94|fter the fluffily final accounts. fluffily final notornis detect quickly. slyly express pinto beans cajole blithely blithely regular packages. pinto beans alongside of the carefully regu
324|29|8011|583.67|pinto beans could have to haggle slyly. thinly unusual deposi
324|16|5352|789.53|s will sleep slyly against the final theodolites. fi
325|26|8818|982.96|unts cajole. blithely special accounts cajole slyly. furiously regular pinto beans haggle blith
325|13|3085|314.81|place of the carefully even dinos. ironic requests cajole instructions. theodolites above the slyly regular theodolites are even packages. quickly unusual escapades are regularly above the foxes!
325|30|511|457.53|oss the accounts. carefully even foxes before the quickly final accounts are furiously according to the regular, regular pinto beans-- slyly quiet accounts boost carefu
325|17|7915|521.61|r the furiously even asymptotes. bravely bold packages boost furiously. bold theodolites sleep. slyly ironic requests wake fluffily among the even, en
326|27|464|717.88|fter the express deposits. asymptotes cajole slyly among the brave platelets. express, final excuses affix. packages sleep ruthlessly
326|14|7160|592.60|ronic deposits wake slyly regular ideas. pinto beans across the carefully even ideas affix furiously fluffily final accounts. packages are blithely above the r
326|1|8293|939.01|gle according to the carefully special accounts. unusual ideas haggle furiously ironic foxes. pending somas cajole carefully furiously ironic requests. unusual 
326|18|2648|813.21|unts are ideas. final deposits shall have to are furiously special packages-- final dependencies use according to the carefully final instructions. furiously ironic mu
327|28|5214|447.89|ffix furiously even, unusual accounts. dependencies boost blithely above the regular pinto beans. final instruction
327|15|2157|351.69|leep furiously. pending requests integrate carefully slyly regular ideas. regular, final packages are slyly regular pinto beans-- bol
327|2|4890|51.95|ans haggle fluffily carefully pending requests. blithely bold packages wake. unusual packages believe above the regular, regular platelets. final account
327|19|7862|290.17|uests. regular requests haggle. blithely bold requests l
328|29|9311|976.49| deposits. quickly even accounts cajole carefully. slyly pending dugouts poach. furiously regular packages nod furiously: fluffily final deposits sleep fluffily. e
328|16|5566|346.00|al ideas. carefully daring packages above the slyly silen
328|3|7348|213.64|instructions cajole carefully even courts. slyly express dependencies nag slyly. final theodolites believe. furiously pending packages after the furiously ironic sentiments ne
328|20|4267|517.57|inal packages sleep furiously according to the slyly final requests. special accounts wake furiously unusual ideas. express frays haggle slyly! regular foxes haggle. accounts sleep quickly quickly 
329|30|3180|757.13|of the furiously even instructions haggle slyly about the furiously ironic warthogs. unusual requests sleep ironically against the pend
329|17|1135|974.30|uests integrate. pending packages are quickly among the furiously even packages. fluffily bold foxes grow regul
329|4|8056|565.80|ly. express, furious packages wake blithely fluffil
329|21|8133|167.54|ording to the special packages. instructions boost unusual requests. blithely ironic platelets affix slyly against the furiously bold pinto beans. requests against t
330|1|3634|839.23| the pinto beans eat at the quiet deposits. express, bold sentiments sleep blithely according to the blithely ironic theodolites. furiously even instruction
330|18|9489|214.60|egular excuses wake furiously ironic, bold dinos. fluffily sp
330|5|9145|539.12|lyly ironic ideas nag furiously ironic warhorses. quickly express packages after the furiously bold accounts grow slyly final, even deposits. quickly silent excuses hin
330|22|521|183.79|the furiously ironic accounts. sentiments are with the furiously silent accounts. regular requests i
331|2|5261|275.80|ly express packages grow fluffily along the blithely even packages
331|20|5649|176.15| furiously carefully regular dolphins. carefully ironic braids boost fluffily quickly ironic dependencies. carefully even ac
331|8|6616|830.53|ironic accounts sleep blithely fluffily ironic packages. furiou
331|26|4664|882.46|t requests beneath the final courts haggle furiously after the special requests! blithely ironic packages across the sl
332|3|238|471.35|efully final accounts. carefully unusual frays grow after the furiously unusual foxes. accounts among the blithely express foxes 
332|21|7465|151.88| to the regular, regular deposits. slyly final dependencies sleep requests. slyly regular 
332|9|2373|517.55|nag fluffily against the special packages. final, final deposits integrate. slyly regular packages wake. final foxes across the regular, pending theodolites use blithely about the slyly r
332|27|6771|404.96|onic instructions use slyly regular, regular packages. blithely pending deposits according to the furiously regular accounts cajol
333|4|229|249.97|uctions promise above the regular pinto beans. regular accounts along the slyly even packages ar
333|22|5833|590.86|ges wake carefully regular requests. regular deposits could affix furiously. carefully ironic requests
333|10|6697|647.82|mptotes nag furiously! furiously pending accounts sleep final foxes. final, regular accounts about the carefully special asymptotes sleep ca
333|28|3264|937.23|etimes express theodolites cajole along the quickly ironic accounts. quickly ironic packages are thinly even requests. silent deposits haggle against the fluffily regular escapades.
334|5|1349|854.29| hockey players haggle inside the special, ironic packages.
334|23|3036|555.50| even, regular platelets wake deposits. special deposits haggle acros
334|11|1715|758.64|about the quickly unusual ideas. theodolites sleep carefully fluffily ironic foxes. express packages are furiously about the accounts. slyly ironic asymptote
334|29|5313|406.96|ake quickly after the final pinto beans. blithely ironic deposits nod. blithely even 
335|6|8763|738.18|uctions haggle. quickly silent dolphins nag blithely regular requests. blithely final dolphins may wake quickly final requests. blithely silent ideas after the even accounts print ab
335|24|8252|130.65|r foxes use. blithely silent accounts wake according to the pending epitaphs. slyly special packages about the fluffily regular deposits wak
335|12|2622|330.78|sleep quickly. pending theodolites haggle behind the unusual deposits. ironic packages integrate about the slyly bold excuses. packages along the regular, ironic requests wake along
335|30|7246|130.57|ar, regular accounts sleep carefully. regular deposits wake carefully final requests. ironic accounts cajole quickly. daring, final accounts
336|7|4173|954.09|ggle after the ideas. carefully even dependencies are furiously along t
336|25|7958|498.61|ithely against the slyly ironic packages. fluffily silent packages against t
336|13|7360|648.62|nding, even dinos. final, even requests haggle furiously. special, regular packages nag carefully across the special, even pinto beans. furious
336|1|1661|339.32|ntain along the furiously ironic packages. express accounts sleep quickly. deposits cajole slyly regular ideas. final excus
337|8|5120|848.90| boost ruthlessly. blithely silent accounts about the fluffily special requests cajole quickly pendin
337|26|8361|839.89|ording to the carefully even pinto beans cajole quickly about the fluffily ironic
337|14|4671|229.87|arefully ironic asymptotes detect. slyly idle gifts wake quietly quickly sp
337|2|7643|451.43|ts believe quickly about the furiously ironic foxes. furiously brave deposits according to the carefully final courts haggle furiously slyly silent requests. accounts doubt blithely ironic ac
338|9|3179|938.61|lly ironic decoys. final ideas haggle fluffily express foxes. ironic, pending accounts engage blithely. blithely regular packages haggle furiously. fluffily ironic accounts wake above the car
338|27|9828|73.37|s sleep alongside of the slyly regular foxes. final accounts from the final pinto beans nag above the regular ideas. ironic foxes affix after the furiously regular ideas. permanently
338|15|2514|686.08|s boost among the regular, final deposits. ironic, speci
