PS_PARTKEY | PS_SUPPKEY | PS_AVAILQTY | PS_SUPPLYCOST | PS_COMMENT
338|3|3354|689.15|ar foxes haggle packages. furiously ironic accounts haggle fluffily final deposits. bold, regular foxes detect quickly ironic instructions. blithely regular packages are furiously agains
339|10|1413|204.58|nal, express packages. ideas across the final, pending deposits haggle slyly final the
339|28|9921|48.45|ronic deposits are across the express pains. blithely even packages are according to the ironic accounts. idle, final packages boost. special instructions according to the slyl
339|16|7273|312.49|ckly express packages believe slyly along the furiously final theodolites. express accounts sleep carefully alongside of the even instructions? carefully ironic pac
339|4|1279|511.49|kages. deposits among the carefully final dependencies haggle despite the furiously final p
340|11|7657|471.88|nding warthogs. permanently final instructions thrash blithely along the fluffily special accounts? packages kindle ironically slyly express requests. 
340|29|4440|977.44|ironic packages. furiously regular instructions acco
340|17|7300|415.14|ar requests. blithely final accounts sleep express requests. even dependencies use blithely-- quickly unusual accounts wake deposits. fluffily iro
340|5|9067|441.56|. bold instructions are carefully blithely final foxes. slyly unusual ideas wake slowly aroun
341|12|6928|943.16|inal packages affix permanently regular, regular foxes. packages nod. final accounts wake carefully slyly regular platelets. fluffily ironic packages wake furiously across the slyly sp
341|30|9855|629.22|ully even asymptotes nag quickly. blithely even accounts do cajole fluffily. slyly special deposits haggle ironically. stealthily even courts
341|18|539|125.74|oost. pinto beans nag blithely. pains sleep fluffily along the blithely unusual request
341|6|7697|632.54|ecial dugouts detect slyly regular, ironic instructions. final, bold patterns haggle among the fluffily bold ideas. ironically final platelet
342|13|1221|831.51|lithely furious requests. blithely regular grouches mold final, pending deposits. special packages after the furiously ironic dinos a
342|1|3567|380.47|arefully even deposits detect pending packages. express, regular pinto beans are furiously bold ideas. stealthily even ideas are slyly. ironic requests use quickly bold deposits. courts inte
342|19|6128|105.32|ckly bold accounts. slyly pending deposits wake af
342|7|2518|79.22|nag quickly regular accounts. instructions boost slyly furiously final dependencies. slyly even ideas boost even packages. quickly even accounts alongside of the blithely ironic
343|14|3058|18.48| blithely regular packages. slyly unusual accounts breach. regular packages after the slyly blithe accounts are ironic instru
343|2|5322|242.79|telets wake blithely ideas. slyly regular packages cajole after the slyly special accounts. carefully express requests are across the express ideas. final packages wake slyly along the express, dar
343|20|458|857.63|ending dependencies. furiously express packages solve against the pinto beans. furiously regular deposits are
343|8|7323|771.94|ording to the idle accounts. quickly express requests haggle. quickly express packages boost across the blithely regular packages. furiously
344|15|8115|60.81| special asymptotes. special, pending requests nag fluffily against the slyly ironic excuses. carefully express frays use express, final courts. unusual, even foxes use furiously pending packages. 
344|3|948|324.26|hely special asymptotes detect furiously. furiously express dependencies wake blithely after the pending platelets. furiously express instructions above the dependencies 
344|21|7118|463.06|. blithely regular deposits are furiously blithely pending requests. slyly even deposits poach slyly blithely regular accounts. slyly regular platelets int
344|9|7524|541.23|egular, special requests. furiously ironic instructions sleep slowly. foxes along the theodolites could sleep fluff
345|16|2457|786.54|pending dugouts. carefully bold theodolites use slyly special excuses. regular deposits boost foxes. idly silent deposits after the packages are pi
345|4|7767|667.42|ly blithe requests detect furiously. furiously express packages lose alongside of the final platelets. regular requests use pending, i
345|22|8463|638.37| furiously ironic deposits about the accounts print blithely against the sly pains. blithel
345|10|9498|995.31|unts nag fluffily furiously even patterns. special requests sublate ironic depths. regular, regular ideas detect furiously special packag
346|17|6697|26.92|kages instead of the foxes are regularly across the regular ideas. pending asymptotes cajole behind the blithely express packages. unusual packages nag carefully ironic requests. blithely special as
346|5|6640|92.13|es. furiously unusual excuses sleep slyly slyly pending foxes. carefully express pin
346|23|8858|261.72|the slyly pending accounts. slyly regular ideas sleep ironic foxes. slyly bold platelets above the ideas nag Tiresias. furiously reg
346|11|5835|302.24|es. carefully ironic instructions nag blithely. bravely even deposits sleep fluffily furiously final packages. even, ironic warthogs after the iro
347|18|5863|8.56| fluffy ideas. regular, ironic pinto beans wake. courts after the dependencies are carefully above the carefully regular accounts. slyly ironic accounts 
347|6|9132|306.86|avely regular pinto beans. blithely silent accounts cajole final sentiments. careful ideas affix slyly slyly regular decoys. re
347|24|4618|833.43|ly regular pinto beans affix daringly even, even foxes. even deposits maintain. ironic deposits sleep carefully. special, regular accounts cajole after the regular ideas-- blithely 
347|12|478|675.62|s. slyly ironic packages cajole slyly? quickly pending requests nag blithely. unusual, regular theodolites sleep. theodolites wake quickly excuses. furiously blithe courts haggle outside the qu
348|19|4129|603.76|hins wake quickly. carefully pending requests haggle furiously. quickly final pinto beans sleep furiously. furiously even acc
348|7|4958|640.25|lyly at the packages. accounts nag regular dependencies. idly bold dolphins wake slyly across the blithel
348|25|4606|659.38|after the even deposits. boldly regular instructions use even pinto beans. accounts play idly. final deposits x-ray: pending, even forges between the 
348|13|7744|452.86|bold, bold foxes. courts ought to wake. carefully regular she
349|20|2419|969.27|c accounts lose bold, express deposits! permanent, final packages wake
349|8|253|957.16| courts. carefully quick requests cajole busily even, unusual ideas. furiously final pinto beans cajole slyly along the ironic
349|26|7454|205.04|final deposits above the blithely ironic theodolites na
349|14|8502|828.77|regular asymptotes. bold instructions integrate slyly furiously even deposits. furiously unusual platelets are unusual accounts. slyly regular ideas wake furiously fi
350|21|5552|286.09|odolites along the blithely pending ideas are carefully since the final, ironic de
350|9|1219|412.60|ar excuses play carefully about the thinly regular accoun
350|27|3715|771.14|e carefully according to the regular accounts: final, unusual
350|15|2336|689.44| ironic, regular dolphins haggle. carefully final accounts lose. pending, regular packages affix furiously carefully special courts? carefully silent platelets ki
351|22|4245|141.81|le furiously along the excuses. final foxes are alongside of the b
351|10|1754|951.21|latelets cajole slyly slyly regular instructions. carefully ironic theodolites detect carefully final foxes. furiously silent platelets serve blithely. even pack
351|28|3954|107.33|s hang slyly along the final deposits. ironic, regular excuses against the slyly regular deposits sleep quickly express requests. quickly even re
351|16|9106|984.30|ld asymptotes wake around the slyly unusual pinto beans. fluffily special deposits snooze against the blithely express courts. furiously unusual asympto
352|23|1751|757.34|ongside of the regular deposits cajole fluffily around the ev
352|11|6905|534.11|ual patterns dazzle quickly along the never even excuse
352|29|3116|899.22|yly regular platelets. unusual, even warhorses cajole furiously across the expres
352|17|2576|422.98|ove the silent, regular multipliers. sheaves doubt. instructions haggle furiously among the fluffily final warthogs. instructions according t
353|24|8705|250.61|unusual deposits boost slyly against the final, regular packages. final, pending instruc
353|12|6230|491.76|s. permanently unusual requests among the slyly ironic instructions wake despite the fluffily even pinto beans? carefully final packages against the quickly regular dependencies cajole 
353|30|8479|425.50| pinto beans cajole. final accounts about the even foxes boost deposits. blithely pending patterns are fluffily quickly final ideas. final accounts sleep bl
353|18|7642|698.38|sits. even requests cajole quickly. instructions haggle furiously furiously regular patterns. f
354|25|7041|517.87|ccounts. ironic accounts boost above the fluffily slow deposits. fluffily unusual accounts print furiously. furiously final packages affix fluffily. ironic, pending pinto beans at
354|13|4171|746.59|y even accounts. quickly silent courts wake blithely requests. carefully ironic requests cajole ruthlessly. furiously bold acco
354|1|4564|682.21|g the special asymptotes. final instructions cajole pinto beans. express, express decoys across the slyly bold pinto beans are according to the enticingly ironic requests. slyly
354|19|5127|559.61|xcuses wake carefully about the regular, ironic fox
355|26|6679|881.63|eodolites sleep slyly in place of the ironic platelets; regular theodolites wake busily around the carefully ironic deposits. pending, express platelets are acco
355|14|4837|543.19| ideas haggle fluffily. regular ideas cajole fluffily fluffily unusual pinto beans. even, even packages to
355|2|3157|636.73|the furiously special instructions? dogged requests cajole slyly furiously unusual deposits. doggedly even deposits haggle. ironic, even requests after the blithe
355|20|9387|328.97|ns are fluffily. slyly pending packages haggle among the fluffily ironic accounts. blithely even excuses are even forges. carefully express deposits cajole qui
356|27|5640|659.89| instructions. furiously pending ideas boost above the quickly i
356|15|5077|961.17|lar packages sleep furiously. regular requests cajole-- blithely bold deposits sleep quietly after the furiously even packages. carefully ironic ac
356|3|1357|721.25|yly ironic accounts. furiously unusual platelets cajole carefully according to the blithe pinto beans. slyly unusual ideas cajole silent depths-- slyly even instructions cajole qu
356|21|3285|308.49|ve to doubt blithely. ironic, ironic packages hang around the final, even requests. slyly even requests agains
357|28|9623|169.85|ngside of the slyly permanent foxes. regular ideas wake carefully
357|16|3547|836.51|ons. pending pinto beans kindle pending platelets. b
357|4|4786|494.30| regular accounts wake slyly. slyly even foxes use against the carefully regular ideas. asymptotes alongside of the regular deposits are slyly along the furiously regul
357|22|7086|272.45|e quiet dependencies. carefully express pinto beans wake furiously quickly pending requests. slyly ironic packages haggle busily according to the regular requests. blithely ironic dolphins 
358|29|8036|812.42|ngside of the ironic, slow theodolites cajole regularly excuses. 
358|17|216|63.19|hely ironic accounts cajole among the blithely ironic theodolites. bold requests despite the blithely regular requests sleep across the fluf
358|5|8393|323.40|haggle. pending courts integrate carefully about the ideas. carefully unusual theodolites cajole furiously carefully pending requests
358|23|6497|27.27|. final, ironic accounts cajole. regular pinto beans promise carefully final epitaphs; ruthlessly ev
359|30|3678|67.67|ages. slyly ironic packages haggle slyly furiously regular deposits. carefully special requests was furiously. furiously express deposits nag fluffily carefully final packages.
359|18|7459|677.93|ess dependencies engage fluffily carefully express excuses. furiously express packages cajole among the final deposits. c
359|6|4180|521.57|ccounts use furiously against the unusual, ironic asymptotes. ironic instructions boost against the packages. quickly pending deposits after the furiously pending theodolites slee
359|24|4489|969.83|ts. requests cajole carefully according to the even, special
360|1|5834|420.19|deas. carefully special accounts use regularly furiously ironic requests: fluffily even theodolites wake fluffily. c
360|19|4885|362.25|daringly carefully ironic accounts! fluffily regular pinto beans haggle. fluffily final deposi
360|7|9191|710.51|r requests are. slyly ironic packages along the slyly regular tithes are among the quickly final requests. slyly eve
360|25|2781|603.73|g to the furiously regular packages. slyly unusual dolphins sleep carefully slyly unusual packages. special foxes cajole fluffil
361|2|8423|239.47|uickly unusual accounts are slyly. carefully even platelets use about the final, regular excuses. silently ir
361|21|809|32.98|the unusual instructions. furiously enticing instructions run finally about the final forges. special, final asymptotes pr
361|10|3324|124.37|ily. carefully regular accounts integrate blithely. blithely express dependencies sleep even accounts. carefully express deposits use blithely 
361|29|7628|563.91|e quickly ironic ideas. bold platelets are carefully. regular instructions are carefully. furiously special foxes sleep. slyly even realms cajole a
362|3|9122|309.21| finally; ironic packages wake fluffily above the furiously final packages. even accounts toward the slyly expr
362|22|6711|357.00|ss the blithely express ideas integrate furiously alongside of the requests. silent instructions engage. furiously special pa
362|11|7455|322.25|gle blithely inside the carefully regular requests. blithely regular platelets do was carefully; final f
362|30|9990|680.32|ickly ironic grouches wake furiously. furiously special packages wake blithely bold, ironic theodolites. dependencies at the slyly ironic deposits cajole carefully alongside o
363|4|442|678.58|. fluffily sly deposits haggle after the ironic deposits. even, ironic foxes cajole never furiously express packages. excuses play. final, regular packages are final requests. quickly
363|23|968|413.65|es. ironic foxes after the regular pinto beans wake even deposits. carefully pending platelets use after the quick, final excuses. quickly regular asym
363|12|5171|373.26|ideas. slyly final waters at the fluffily special deposits believe slyly after the sometimes regular pinto beans. theodolites haggle 
363|1|6752|857.86| deposits serve sly, unusual theodolites. ironic ideas sleep. 
364|5|9828|667.85|ronic requests eat furiously stealthy packages. slyly pending dependencies haggle blithely across the instructions
364|24|5570|940.12| thrash carefully across the slyly special accounts. quickly regular accou
364|13|7766|541.32|lowly final theodolites nag fluffily carefully even requests. slyly even excuses shall kindle furiously according to the fluffily pending platelets. regular theodolites subla
364|2|8146|325.86|eep. final foxes nag blithely about the carefully express accounts. slyly regular requests use theodolites. carefully special instructions against the slyly regular p
365|6|7178|416.80|sts are furiously fluffily even accounts. quickly final deposits thrash blithely across the express deposits. always express de
365|25|4870|290.80|nal excuses cajole carefully slyly unusual theodolites-- blithely even instructions ab
365|14|1931|536.60| carefully close accounts. regular deposits affix. slyly even deposits affix ironic deposits. platelets about the furiously express packages eat quickly ironic
365|3|7792|916.86|thy packages sleep slyly along the blithely final packages. dependencies are fluffily around the carefully even accounts. even 
366|7|8509|161.03| special warhorses are carefully. carefully special packages about the blithely final requests sleep blithely against the requests. carefully unusual deposits cajole carefully. pending, bo
366|26|8356|456.23|ular, ironic excuses detect furiously among the deposits. blithely bold packages along the carefully ironic ideas use about the enticingly ironi
366|15|2143|755.61| wake slyly. blithely regular deposits affix quickly. slyly special foxes wake furiously. carefully regular accounts dazzle idly final packages. furiously express r
366|4|8545|343.32|ithely final platelets nag! unusual pinto beans use carefully. fluffily regular deposits was against the furiously special packages. blithely expre
367|8|2874|232.30|r excuses haggle pending, regular courts. furiously ironic requests lose slyly among the bo
367|27|4845|313.44|gular deposits boost slyly ironic deposits. quickly even ideas boost carefully quickly regular packages. ironic, pending requests according to the bold, i
367|16|3938|439.43|es sleep regular requests. carefully regular ideas slee
367|5|7919|995.51|arefully ruthless accounts nag. carefully bold accounts wake blithely express asymptotes. ironic pinto beans haggle quickly sly, bold instructions. slyly ironic accounts ha
368|9|2368|416.28|ending courts haggle above the fluffily final ideas. pending accounts
368|28|5549|606.88|ckages. final asymptotes nag never deposits. slyly bold requests sleep
368|17|2379|283.24|yly. fluffily final foxes above the final deposits wake quickly above the pending, pending foxes. quickly regular packages hang boldly even ideas. thin theodolites haggle. always fi
368|6|1356|388.64|eans integrate blithely pending requests. furiously even theodolites print ironic sauternes. carefully bold ideas nod slyly unusual foxes. slyly special pin
369|10|215|621.06|long the deposits. regular accounts around the carefully even foxes affix among the carefully final dolphins. carefully ir
369|29|202|690.31|ual courts after the quickly regular multipliers sleep carefully ironic accounts. quickly ironic dolphins maintain. slyly even platelets wake 
369|18|5102|750.65|wake slyly silent foxes. pinto beans haggle closely final accounts. packages boost blithely above the carefully ironic requests. fluffily 
369|7|4479|882.72|ic gifts. regular deposits use blithely. furiously regular platelets according to the car
370|11|473|783.58|ously even ideas haggle fluffily along the carefully ironic pinto beans. blithely special packages are among the carefully final accounts. sly, ironic theodolites wake slyly. packages cajole furi
370|30|4006|892.40|egular courts nod quickly above the fluffily pending accounts. fluffily sly dolphins haggle furiously slyly bold accoun
370|19|5236|695.64|ites along the accounts cajole blithely about the slyly unusual pinto beans. regular requests use slyly about the courts. carefully special foxes wake furiously against t
370|8|7527|552.41|ing accounts. carefully ironic sauternes lose special, express requests. blithely regular foxes cajole quickly slyly ironic accounts. carefully ironic gifts boost. eve
371|12|4707|849.13|ording to the slyly special requests. theodolites haggle blithely. es
371|1|7194|795.26|romise. blithely final pinto beans poach blithely. blithely
371|20|5155|454.70|ons against the silent, pending escapades could have to detect slyly according to the q
371|9|3644|47.59|ts detect furiously silent packages. slyly bold theodolites according to the regular, unusual deposits nag furiously above the blithely pendin
372|13|4051|835.63|s haggle across the slyly express deposits. quickly unusual dolphins integrate furiously express dolphins. quickly regular deposits serve. blithely express accounts a
372|2|64|643.09|d courts. blithely ironic requests wake. furiously 
372|21|3420|374.77|ully final deposits sleep furiously. quickly ironic deposits impress ruthlessly after the
372|10|4572|332.86|er blithely instead of the silent courts. ironic, express requests haggle blithely quickly final accounts. furiously even asymptotes nag f
373|14|6598|249.47|c, close accounts sleep furiously above the pending dependencies. furiously silent accounts integrate bold, regular deposits. express accounts among the blithely even excuses wa
373|3|2376|262.30|usly regular packages shall have to affix slyly final pinto beans. slyly ironic waters run. care
373|22|2838|81.94|haggle ironic deposits. furiously special platelets wake quickly pains. even 
373|11|6119|708.73|nic accounts use slyly carefully regular packages. furiously unusual pinto beans detect quickly fluffily regular dependencies. blithely final ideas sleep 
374|15|1876|714.84| the warhorses boost furiously after the carefully ironic foxes. furiously regular requ
374|4|1826|399.46|uickly special dependencies! furiously express deposits whithout the slyly exp
374|23|9828|641.00|p fluffily. quickly ironic packages boost quickly quickly idle pinto beans. quickly unusual deposits haggle blithely along the packages. blithely even dependencies sleep care
374|12|9204|150.28|e packages affix quickly slyly express packages. deposits haggle. regula
375|16|2822|475.83|packages. quickly unusual deposits kindle alongside of the carefully bold packages. furiously regular foxes use carefully slyly final accounts. final requests according
375|5|4114|460.86|, unusual Tiresias haggle slyly even theodolites: ironic, even deposits affix slyly. pinto beans above the carefully regular ideas boost regular deposits. i
375|24|8680|673.03|le blithely enticingly regular courts: final packages use above the furiously unusual ideas. regular foxes cajole fluffily along the blithely unusual patterns. carefully regular orbits according
375|13|3965|151.67|s-- sometimes bold asymptotes sleep after the blithely final pinto beans. enticingly silent pinto beans along the blithely even deposi
376|17|3666|895.66|re? bold deposits cajole. carefully special theodolites use furiously. carefully unusual theodolites are among the furious foxes. deposits thrash regular ideas. even dep
376|6|4524|529.52|iously. packages after the slyly final accounts sleep among the quickly even in
376|25|680|731.93|yly. regular pearls against the excuses sleep slyly blithely ironic theodolites. s
376|14|9418|39.91|ipliers haggle carefully express platelets. unusual theodolites haggle ironically above the final, close foxes. furiously regular r
377|18|9022|665.73|hely pending deposits integrate according to the regular foxes. furiously ironic ideas sleep about the ironic
377|7|966|296.70|as haggle carefully. blithely unusual frets sleep furiously slyly final requests. furiously bold requests cajole about the packages. pending, even pinto beans affix. fluffil
377|26|762|757.99|ccounts haggle slyly special requests. express, final foxes solve boldly regular theo
377|15|7490|448.57|final excuses use. carefully silent packages according to the furiously pending 
378|19|5057|894.75| the unusual accounts! never final foxes nag blithely: quickly final accounts detect closely. frets detect. special deposits about the blithely 
378|8|5433|159.38| packages boost; carefully regular accounts detect closely-- furiously final deposits wake silent,
378|27|6012|671.42|tes. final deposits snooze. always even accounts boost across the requests. fluffily regular packages sublate blithely final, final asymptotes. final theodolites boost fluffily 
378|16|2909|34.65|fter the ironic pearls. furiously final requests are. unusu
379|20|1136|243.36|y final pinto beans nag slyly among the slyly ironic packa
379|9|4070|473.81|nts. ideas play slyly across the final gifts. even, even platelets at the furiously final dependencies lose according to the slyly regular requests.
379|28|4749|491.78| instructions boost carefully. instructions wake carefully about the carefully silent deposits? fluffily ironic packages along the slyly bold platelets sleep carefully a
379|17|2160|738.81|y ironic orbits? furiously unusual asymptotes detect carefully. quickly ironic theodolites
380|21|5384|680.64|ake furiously ironic, regular excuses. stealthy pearls use blithely above the furiously regular requests. even, pending dolphins haggle packages. silent 
380|10|6216|134.72| unusual packages. carefully express pearls are a
380|29|9253|774.65|osits alongside of the regular, ironic requests are among the carefully regular instructions. furiously pending grouches are. fluffily bold dependencies nag quickly. 
380|18|2627|730.90|y even theodolites. unusual ideas for the furiously express accounts cajole among the carefully special package
381|22|2984|691.99|above the final platelets. special instructions are. quickly pending theodolites poach carefully furiously silent foxes. blithely ironic requests integrate after
381|11|8803|54.31|e among the ideas. even, pending instructions cajole blithely along the iro
381|30|6258|10.65|ily. carefully final dinos haggle blithely furiously even dinos. unusual instructions are carefully
381|19|8277|402.53| use carefully. blithely even packages cajole blithely. blithely ironic deposits after the final, ironic platelets kindle quietly a
382|23|8797|342.68|al requests. furiously ironic packages sleep carefully above the deposits. bravely pending packages after the pinto bea
382|12|3300|355.44| sublate doggedly accounts. express instructions above the furiously special instructions boost blithely slyly regula
382|1|7897|14.97|ns. bold requests boost. unusual dolphins use. requests sleep never. fluffily express foxes wake fluffily above the furiously unusual ideas. 
382|20|6546|165.15|le quickly regular excuses. carefully even instructions promise along the quickly express ideas: blithely regular deposits nag blithe
383|24|8632|681.73|usly about the quickly even accounts. even dolphins wake blithely across the closely pending deposits. slyly express dep
